{
  "$schema": "../../schemas/auth-flow-handler.schema.json",
  "schemaVersion": "1.0",
  "key": "auth.handler.recovery.verify",
  "name": "Password Recovery Verification Flow Handler",
  "summary": "Provides the typed application boundary for six-digit recovery-code verification and maps the result to canonical accepted or rejected transitions.",
  "version": 1,
  "maturity": "implemented",
  "repository": "LagoVista/UserAdmin",
  "projectPath": "src/LagoVista.UserAdmin",
  "sourcePath": "src/LagoVista.UserAdmin/Authentication/Flows/PasswordRecoveryVerificationFlowHandler.cs",
  "interfaceName": "IAuthenticationFlowHandler<PasswordRecoveryVerificationFlowRequest, string>",
  "typeName": "PasswordRecoveryVerificationFlowHandler",
  "methodName": "HandleAsync",
  "requestContract": "PasswordRecoveryVerificationFlowRequest",
  "resultContract": "AuthenticationFlowResult<string>",
  "transitionKeys": [
    "auth.transition.password-recovery.code-accepted",
    "auth.transition.password-recovery.rejected"
  ],
  "dependencies": ["IPasswordManager"],
  "notes": [
    "The handler delegates proof validation and reset-token generation to PasswordManager and exposes only the normalized accepted/rejected transition result."
  ],
  "sourceReferences": [
    { "sourceType": "code", "reference": "LagoVista/UserAdmin:src/LagoVista.UserAdmin/Authentication/Flows/PasswordRecoveryVerificationFlowHandler.cs", "note": "Implemented typed handler and canonical transition keys." }
  ]
}
