{
  "$schema": "../../schemas/auth-flow-handler.schema.json",
  "schemaVersion": "1.0",
  "key": "auth.handler.recovery.request",
  "name": "Password Recovery Request Flow Handler",
  "summary": "Provides the typed application boundary for requesting password recovery while delegating password reset mechanics to the existing password manager.",
  "version": 2,
  "maturity": "implemented",
  "repository": "LagoVista/UserAdmin",
  "projectPath": "src/LagoVista.UserAdmin",
  "sourcePath": "src/LagoVista.UserAdmin/Authentication/Flows/PasswordRecoveryRequestFlowHandler.cs",
  "interfaceName": "IAuthenticationFlowHandler<PasswordRecoveryRequestFlowRequest>",
  "typeName": "PasswordRecoveryRequestFlowHandler",
  "methodName": "HandleAsync",
  "requestContract": "PasswordRecoveryRequestFlowRequest",
  "resultContract": "AuthenticationFlowResult",
  "transitionKeys": ["auth.transition.password-recovery.request-accepted"],
  "dependencies": ["IPasswordManager"],
  "notes": [
    "The handler records the canonical non-enumerating request-accepted transition while token generation and email delivery remain in PasswordManager.",
    "PasswordRecoveryRequestFlowHandler.TransitionKey is the implementation source of truth for this descriptor."
  ],
  "sourceReferences": [
    { "sourceType": "code", "reference": "LagoVista/UserAdmin:src/LagoVista.UserAdmin/Authentication/Flows/PasswordRecoveryRequestFlowHandler.cs", "note": "Implemented typed handler and canonical transition key." }
  ]
}
