{
  "$schema": "../../schemas/auth-flow-handler.schema.json",
  "schemaVersion": "1.0",
  "key": "auth.handler.password-sign-in",
  "name": "Password Sign-In Flow Handler",
  "summary": "Provides the typed application boundary for password authentication and classifies manager results into canonical Success, Rejected, or Locked Out transitions.",
  "version": 1,
  "maturity": "implemented",
  "repository": "LagoVista/UserAdmin",
  "projectPath": "src/LagoVista.UserAdmin",
  "sourcePath": "src/LagoVista.UserAdmin/Authentication/Flows/PasswordLoginFlowHandler.cs",
  "interfaceName": "IPasswordLoginFlowHandler",
  "typeName": "PasswordLoginFlowHandler",
  "methodName": "HandleAsync",
  "requestContract": "AuthLoginRequest",
  "resultContract": "AuthenticationFlowResult<AuthenticationResponse>",
  "transitionKeys": [
    "auth.transition.password-sign-in.success",
    "auth.transition.password-sign-in.rejected",
    "auth.transition.password-sign-in.locked-out"
  ],
  "dependencies": ["ISignInManager"],
  "notes": [
    "The handler does not implement credential validation; it delegates to ISignInManager and classifies only stable modeled result codes.",
    "AUTH001 maps to Rejected and AUTH030 maps to Locked Out; unexpected failures are not silently collapsed into Rejected.",
    "AuthenticationFlowService is the stable application front door and validates that emitted transitions belong to this set."
  ],
  "sourceReferences": [
    { "sourceType": "code", "reference": "LagoVista/UserAdmin:src/LagoVista.UserAdmin/Authentication/Flows/PasswordLoginFlowHandler.cs", "note": "Implemented typed handler and canonical transition classification." },
    { "sourceType": "code", "reference": "LagoVista/UserAdmin:src/LagoVista.UserAdmin/Authentication/AuthenticationFlowService.cs", "note": "Stable application front door validates Password Sign In transitions." },
    { "sourceType": "code", "reference": "LagoVista/UserAdmin:src/LagoVista.AspNetCore.Identity/Managers/SigninManager.cs", "note": "Domain manager owns password authentication, public result codes and auth-log events." }
  ]
}
